{
  "outDir": ".oh-my-memory",
  "sampleIntervalMs": 300,
  "maxSamples": 1500,
  "logTailBytes": 65536,
  "baselineFile": ".oh-my-memory/baseline.local.json",
  "baselineThresholds": {
    "regressionRssBytes": 157286400,
    "regressionDurationMs": 20000,
    "improvementRssBytes": 52428800,
    "improvementDurationMs": 4000
  },
  "sentryDsnEnv": "OH_MY_MEMORY_SENTRY_DSN_LOCAL"
}
